链接,名字,组成,用法,功效,主治
http://www.zhongyoo.com/fangji/wbsyw_12575.html,无比山药丸,组成山药二两(60克)，肉苁蓉四两(120克)，五味子六两(180克)，菟丝子、杜仲各三两(各90克)，牛膝、泽泻、干地黄、山茱萸、茯神(一作茯苓)、巴戟天、赤石脂各一两(各30克)。,用法上药为末，炼蜜为丸。每服6～9克，每日2～3次，温开水送服。,温阳益精，补肾固摄。,肾气虚惫，头晕目眩，耳鸣腰酸，冷痹骨疼，四肢不温，遗精盗汗，尿频遗尿，带下清冷，舌质淡，脉虚软。
http://www.zhongyoo.com/fangji/jssqw_7859.html,济生肾气丸,组成附子炮两个(15克)，白茯苓、泽泻、山茱萸、山药、车前子、牡丹皮各一两(各30克)，官桂、川牛膝、熟地黄各半两(15克)。,用法蜜丸，每服9克，每日服1～2次。临床应用可改为汤剂，水煎服，每日2次，各药剂量按比例酌减至汤剂常用量。,温补肾阳，利水消肿。,肾阳不足，水湿内停证，尿少身肿，腹胀满，腰酸肢冷，舌淡苔白，脉沉迟。
http://www.zhongyoo.com/fangji/glexj_12567.html,龟鹿二仙胶,组成鹿角十斤(5000克)、龟甲五斤(2500克)、人参十五两(450克)、枸杞子三十两(900克),用法上药熬制成膏。每服初起一钱五分，十日加五分，加至二钱止，空心酒化下，常服乃可(现代用法：初服酒服4.5克，渐加至9克。空腹时服用)。,滋阴填精，益气壮阳。,真元虚损，精血不足证。全身瘦削，阳痿遗精，两目昏花，腰膝酸软，久不孕育，舌淡苔白，脉缓弱。
http://www.zhongyoo.com/fangji/ygy_12560.html,右归饮,组成熟地二三钱(6～9克)可加至一二两(30克～60克)，炒山药二钱(6克)，山茱萸一钱(3克)，枸杞二钱(6克)，炙甘草一二钱(3～6克)，姜制杜仲二钱(6克)，肉桂二钱(3～6克)，制附子一三钱(3～9克)。,用法水煎，空腹温服。,温补肾阳，填精补血。,肾阳不足，腰膝酸痛，气怯神疲，大便溏薄，小便频多，手足不温，阳痿遗精，舌苔淡薄，脉象沉细者；阳虚咳嗽；产妇虚火不归元而发热者；肾虚火衰，晕坠而痛；或阴盛格阳、真寒假热之证。
http://www.zhongyoo.com/fangji/ygw_12559.html,右归丸,组成大怀熟地八两(240克)，炒山药四两(120克)，微炒山茱萸三两(90克)，微炒枸杞四两(120克)，炒珠鹿角胶四两(121克)，制菟丝子四两(120克)，姜汤炒杜仲四两(120克)，当归三两(90克)，肉桂二两可加至四两(60～120克)，制附子二两可加至五六两(60～180克)。,用法制蜜丸，每食前用滚汤或淡盐汤送下。亦可水煎服，用量按原方比例酌减。,温补肾阳，填精益髓。,肾阳不足，命门火衰证，症见年老或久病气衰神疲，畏寒肢冷，腰膝软弱，阳痿遗精，或阳衰无子，或饮食减少，大便不买.或小便自遗，舌淡苔白，脉沉而迟。
http://www.zhongyoo.com/fangji/qlw_12558.html,全鹿丸,组成中鹿(一只)，人参、黄芪、白术、茯苓、当归、川芎、生地黄、熟地黄、天门冬、麦门冬、陈皮、炙甘草、补骨脂、川续断、杜仲、川牛膝、枸杞子、巴戟天、胡芦巴、干山药、芡实子、菟丝子、五味子、覆盆子、楮实子、锁阳、肉苁蓉、秋石各一斤(各500克)，川椒、小茴香、青盐、沉香各半斤(各250克)。,用法上各药精制为末，各称分两，和匀一处。候鹿制胶成就，和为丸。空心临卧时，姜汤、盐汤、沸汤任下，冬月温酒送下。,补肾填精，健脾益气。,老年阳衰，精髓空虚，神疲形瘦，步履不便，手足麻木，阳痿遗尿，舌淡嫩苔薄，脉沉细软、两尺浮大。
http://www.zhongyoo.com/fangji/zyt_12551.html,增液汤,组成玄参一两(30克)、麦门冬八钱(24克)、生地黄八钱(24克)。,用法用水2500毫升，煮取900毫升，口干则与饮令尽，不便再作服。,滋阴清热，润肠通便。,热病伤阴，或阴虚不足，津少口渴，大便秘结，舌干红，脉细稍数或沉而无力。
http://www.zhongyoo.com/fangji/wzy_12550.html,五汁饮,组成梨汁、荸荠汁、鲜苇根汁、麦冬汁、藕汁或用蔗汁。,用法临时斟酌多少，和匀凉服，不甚喜凉者，重汤炖温服。,生津润燥。,温病热邪耗损肺胃阴津，症见口中燥渴，咳吐白沫，质黏不爽，咽干，唇燥，舌红苔少，脉虚细数。
http://www.zhongyoo.com/fangji/qgs_12549.html,启膈散,组成沙参三钱(9克)、丹参一钱(9克)、茯苓一钱(3克)、川贝母一钱五分(4.5克)、郁金五分(1.5克)、砂仁壳四分(1.2克)、荷叶蒂两个(3克)、杵头糠五分(1.5克)。,用法水煎服。,理气开郁，润燥化痰。,噎膈，吞咽梗阻，胸膈痞胀隐痛，嗳气则舒，干呕或泛吐痰涎，或伴大便艰涩，口干咽燥，形体逐渐消瘦，舌红苔白，脉细弦。
http://www.zhongyoo.com/fangji/glyz_12543.html,甘露饮子,组成熟地黄、生地黄、天门冬、麦门冬、枇杷叶、黄芩、石斛、枳壳、甘草、茵陈。,用法上药各等分，为粗末，每服二钱(6克)，水煎温服；牙齿动摇，牙龈腥热，含漱后服。成人亦可按常规剂量酌定各药用量。,滋阴清热，行气利湿。,心胃之热上冲，牙宣口气，牙龈肿烂，时出脓血；咽喉肿痛，口舌生疮，目赤肿痛；湿热黄疸，阴虚盗汗，胃脘疼痛。
http://www.zhongyoo.com/fangji/ywt_12542.html,益胃汤,组成沙参三钱(9克)、麦门冬五钱(15克)、冰糖一钱(9克)、细生地五钱(15克)、炒香玉竹一钱五分(4.5克)。,用法水煎服。,益阴生津。,阳明温病，下后汗出，胃阴受伤;或见胃脘灼热隐痛，饥不欲食，口干咽燥，大便秘结，或干呕、呃逆，舌红少津，脉细数者。
http://www.zhongyoo.com/fangji/xkf_12535.html,消渴方,组成黄连末(6克)、天花粉末(10克)、人乳汁亦可用牛乳代替(30毫升)、藕汁(50毫升)、生地黄汁(50毫升)。,用法后二味汁为膏，入前三味搜和，佐以姜汁10毫升和蜂蜜5毫升为膏。徐徐留舌上，以白汤少许送下，每日 3～4次。(原书无剂量，按常规剂量酌定各药用量),清热生津，滋阴补血。,消渴，口干引饮，消谷善饥，舌红苔燥，脉细弦。
http://www.zhongyoo.com/fangji/yyt_12534.html,玉液汤,组成生山药一两(30克)、生黄芪五钱(15克)、知母六钱(18克)、生鸡内金捣细，二钱(6克)、葛根一钱半(4.5克)、五味子三钱(9克)、天花粉三钱(9克)。,用法水煎服。,益气滋阴，生津止渴,口渴引饮，小便频数，困倦气短，脉虚细无力。
http://www.zhongyoo.com/fangji/edt_12527.html,二冬汤,组成天门冬二钱(6克)，麦门冬三钱(9克)，天花粉、黄芩、知母、荷叶各一钱(各3克)，甘草、人参各五分(各1.5克)。,用法水煎服。,养阴清热，生津止渴。,上消、渴而多饮，肺热咳嗽、痰少，舌红苔少，脉细数。
http://www.zhongyoo.com/fangji/yhw_12526.html,月华丸,组成天门冬、麦门冬、生地黄、熟地黄、山药、百部、沙参、川贝母、阿胶各一两(各30克)，茯苓、獭肝、三七各半两(各15克)。,用法用白菊花，桑叶二两(60克)熬膏，将阿胶化入膏内，和诸药末，炼蜜为丸，每服5～10克，每日2～3次，噙化，吞服。亦可参照临床常用剂量作汤剂水煎服。,滋阴润肺，镇咳止血。,肺肾阴虚，劳瘵久嗽，或痰中带血，舌红苔少，脉细数。
http://www.zhongyoo.com/fangji/yyqft_12517.html,养阴清肺汤,组成大生地二钱(6克)、麦门冬一钱二分(3.6克)、玄参一钱半(4.5克)、生甘草五分(1.5克)、贝母八分(2.4克)、牡丹皮八分(2.4克)、薄荷五分(1.5克)、炒白芍八分(2.4克)。,用法水煎服。糖浆：每服10毫升，日服2次；膏剂：每服15克，日服2次。,养阴清肺，解毒利咽。,阴虚肺燥之白喉。喉问起白如腐，不易拭去，咽喉肿痛，初起或发热或不发热，鼻干唇燥，或咳或不咳，呼吸有声，似喘非喘，脉数无力或细数。
http://www.zhongyoo.com/fangji/scmdt_12516.html,沙参麦冬汤,组成沙参(10克)、玉竹(10克)、生甘草(5克)、桑叶(6克)、生扁豆(10克)、天花粉(10克)、麦门冬(10克)。,用法 水煎服。,清养肺胃，生津润燥。,燥伤肺胃，律液亏损，咽干口渴，干咳少痰，舌红少苔，脉细。
http://www.zhongyoo.com/fangji/ygj_12494.html,一贯煎,组成北沙参(10克)、麦门冬(10克)、当归(10克)、生地黄(15克)、枸杞子(12克)、川檩子(10克)。,用法水煎服，原书剂量缺，按常规剂量酌定。,滋养肝肾，疏肝理气。,肝肾阴虚，肝气不舒，胸脘胁痛，吞酸吐苦，咽干口燥，舌红少津，脉弦细或虚弦。
http://www.zhongyoo.com/fangji/smw_12493.html,桑麻丸,组成桑叶(500克)、黑芝麻(120克)、白蜜(500克)。,用法将黑芝麻捣碎熬浓汁，和蜜炼，滴水成珠，入桑叶末为丸。每服9克，每曰2次，温开水送服。,补益肝肾，养血明目。,肝阴不足或肝肾阴虚所致头晕眼花，肌肤甲错，眼干以及皮肤干燥，须发早白或头发干枯、脱发，久咳不愈，津枯便秘。
http://www.zhongyoo.com/fangji/zydbw_12492.html,滋阴大补丸,组成熟地黄二两(60克)、牛膝一两半(45克)、山药一两半(45克)、山茱萸一两(30克)、杜仲一两(30克)、茯苓一两(30克)、巴戟天一两(30克)、五味子一两(30克)、小茴香两(30克)、肉苁蓉一两(30克)、远志一两(30克)、石菖蒲半两(15克)、甘杞子半两(15克)。,用法上药共研细末，枣肉捣和，蜜丸。每服9克，每日2次，盐开水或黄酒送服。,益肝滋肾。,腰膝酸软，下肢无力，头晕目眩，耳鸣健忘，心神不安，男子遗精，女子带多，舌红苔少，脉弦细。
http://www.zhongyoo.com/fangji/hqw_12491.html,虎潜丸,组成酒炒黄柏半斤(250克)、洒炙龟板四两(120克)、陈皮二两(60克)、酒炒知母二两(60克)、熟地黄二两(60克)、白芍药二两(60克)、锁阳一两半(45克)、炙虎骨一两(30克)、干姜半两(15克)。,用法上药共研细末，酒糊或粥糊或蜜为丸，每丸10克。每服1丸，每曰2次，淡盐汤或开水送服。亦可改用饮片水煎服，用量按常规汤剂剂量。,滋阴降火，强健筋骨。,肝肾阴虚，腰膝酸楚，筋骨痿软，腿足无力，步履不便，舌红苔少，脉细弱。
http://www.zhongyoo.com/fangji/zsqgy_12490.html,滋水清肝饮,组成熟地黄(10克)、山药(10克)、山茱萸(10克)、牡丹皮(10克)、茯苓(10克)、泽泻(10克)、白芍(10克)、栀子(10克)、酸枣仁(10克)、当归(10克)、柴胡(6克)。,用法水煎服，每日2次。原始剂量缺，按常规剂量酌定。,滋阴养血，清热疏肝。,阴虚肝郁，症见胸胁胀痛，耳聋耳鸣，腰膝酸软，口干口苦，大便干结，头目眩晕，骨蒸盗汗，视物模糊，遗精梦泄，舌红苔少，脉弦细。
http://www.zhongyoo.com/fangji/byj_12489.html,保阴煎,组成生地黄二钱(9克)、熟地黄二钱(9克)、芍药二钱(9克)、山药一钱半(9克)、续断一钱半(9克)、黄芩一钱半(9克)、黄柏一钱半(9克)、生甘草一钱(6克)。,用法水煎服，每日2次。,滋阴降火，清热凉血。,阴虚内热，症见带下淋浊，色赤带血，血崩便血，舌红，脉数。
http://www.zhongyoo.com/fangji/zyllt_12488.html,拯阴理劳汤,组成人参(6克)、麦门冬(12克)、白芍(12克)、生地黄(12克)、女贞子(12克)、龟板(15克)、当归(9克)、薏苡仁(9克)、橘红(9克)、牡丹皮(9克)、莲子肉(9克)、百合(9克)、炙甘草(6克)、大枣两枚。,用法水煎服，每日2次。原始剂量缺，按常规剂量酌定。,滋阴润肺，益肾补虚。,肺肾阴虚，症见颧红口干，骨蒸潮热，盗汗体倦，咳嗽气短，遗精滑泄，舌红苔少，脉细数。
http://www.zhongyoo.com/fangji/qbmrd_12487.html,七宝美髯丹,组成赤白何首乌各一斤(各500克)，白茯苓半斤(250克)，牛膝半斤(250克)，当归半斤(250克)，枸杞半斤(250克) ，菟丝子半斤(250克)，补骨脂四两(120克)。,用法蜜丸，每日3次，口服。,滋肾精，养肝血。,肝肾不足，须发早白，腰膝无力，齿牙动摇，遗精，舌红苔少，脉细。
http://www.zhongyoo.com/fangji/hsd_12486.html,还少丹,组成熟地黄五钱(15克)、山药一两半(45克)、牛膝一两半(45克)、枸杞子五钱(15克)、山萸肉一两(30克)、茯苓一两(30克)、杜仲一两(30克)、远志一两(30克)、五味子一两(30克)、石菖蒲一两(30克)、楮实一两(30克)、小茴香一两(30克)、巴戟天一两(30克)、肉苁蓉一两(30克)。,用法炼蜜，枣肉为丸。每服6～9克，每日2次。,补肾养心，益阴壮阳。,精血虚损，心肾不足，症见腰膝酸软，失眠健忘，耳鸣目暗及未老先衰，遗精阳痿，舌淡，脉沉迟。
http://www.zhongyoo.com/fangji/jjfmt_12485.html,加减复脉汤,组成炙甘草六钱(18克)、干地黄六钱(18克)、生白芍六钱(18克)、麦门冬五钱(15克)、阿胶三钱(9克)、麻仁三钱(9克)。,用法水煎服，每日2次。,滋阴补血复脉。,温病后期，久热伤阴，津液耗伤，或久热不退，口干唇燥，烦躁不安，心悸，舌红无苔，脉结代或细数。
http://www.zhongyoo.com/fangji/zgy_12484.html,左归饮,组成熟地黄二三钱至一二两(9～30克)、山药二钱(6克)、枸杞二钱(6克)、炙甘草一钱(3克)、茯苓一钱半(4.5克)、山茱萸一二钱(3～6克)，畏酸者少用之。,用法水煎服，每日2次。,滋阴补肾。,真阴不足，症见腰酸遗泄，头晕目眩，口燥咽干，盗汗，舌红苔少，脉细数。
http://www.zhongyoo.com/fangji/bsyxt_12483.html,补肾养血汤,组成熟地黄、补骨脂、菟丝子饼、丹参、茺蔚子各三钱(各9克)，枸杞子一钱五分(4.5克)，当归二钱(6克)，杜仲、白芍、山茱萸、肉苁蓉各一钱(各3克)，红花五分(1.5克，)胡桃仁四钱(12克)。,用法水煎服，每日2次。,补肝益肾，养血强筋。,关节脱位，舌质偏淡，脉细。
http://www.zhongyoo.com/fangji/xwzw_12482.html,小温中丸,组成青皮一两(30克)，童便浸香附四两(120克)，苍术二两(60克)，半夏二两(60克)，白术半两(15克)，陈皮一两(30克)，苦参半两(15克)，姜汁炒黄连一两(30克)，醋炒针砂二两(60克)。,用法研末，神曲糊为丸。每服6克，每日2次。,燥湿运脾。,脾虚不运，湿热积滞内蕴，腹部胀满，大便溏薄，两足浮肿，苔厚腻，脉滑。
http://www.zhongyoo.com/fangji/jfw_12481.html,绛矾丸,组成皂矾面裹烧红五钱(15克)，杜苍术五钱(15克)，真川朴八钱(24克)，炒广皮六钱(18克)，焦甘草三钱(9克)。,用法煮红枣肉为小丸，姜半夏粉一两(30克)为衣。每次4～6克，每日2次口服，淡姜汤送下。,健脾补血，燥湿杀虫。,脾胃不健，萎黄浮肿，心悸气促，肢体解懒，食积痞块等。
http://www.zhongyoo.com/fangji/zjyxt_12480.html,壮筋养血汤,组成当归、白芍、川续断、杜仲、生地黄、川芎、红花、牡丹皮、牛膝。,用法原方未注明用量，各药剂量可按汤剂常用量。水煎服，每日2次。,养血活络，强筋壮腰。,外伤筋络，筋骨不利，舌边有瘀点，脉沉涩者。
http://www.zhongyoo.com/fangji/bgt_12479.html,补肝汤,组成当归、白芍、熟地黄、炙甘草、川芎、木瓜、酸枣仁。,用法原方未注明用量，各药剂量可按汤剂常用量，水煎服，每日2次。,补肝养筋明目。,肝血不足，筋缓手足不能收持，目暗视物不清，舌质淡，脉弦细。
http://www.zhongyoo.com/fangji/ygw_12478.html,羊肝丸,组成黄连一两(30克)、羊肝一具。,用法水蜜丸，每次9克，每日2次口服。,清热泻火，补肝明目。,白内障，云翳遮睛，青盲等病症。
http://www.zhongyoo.com/fangji/trd_12477.html,通乳丹,组成人参、黄芪各一两(30克)，当归二两(60克)，麦门冬五钱(15克)，木通、桔梗各三分(各1克)，猪蹄两个。,用法临床应用常以饮片用作汤剂，人参改以党参代之，水煎服。,益气养血，催乳通乳。,产后气血两虚，症见乳汁不下，面色咣白，乏力气短，舌淡苔薄，脉濡细。
http://www.zhongyoo.com/fangji/dgsjyrt_12476.html,当归生姜羊肉汤,组成当归三两(90克)、生姜五两(150克)、羊肉一斤(500克)。,用法水煎服。,温中补血，祛寒止痛。,血虚有寒，症见寒疝腹痛，胁痛里急，或产后少腹绵绵作痛、痛及腰胁、喜温喜按，舌苔白，脉虚大。
http://www.zhongyoo.com/fangji/adett_12475.html,安奠二天汤,组成人参一两(30克)、熟地黄一两(30克)、白术一两(30克)、山药五钱(15克)、山茱萸五钱(15克)、炙甘草一钱(3克)、杜仲三钱(9克)、枸杞子二钱(6克)、扁豆五钱(15克)。,用法水煎服，每日2次。,健脾益肾，固冲安胎。,脾肾虚弱，妊娠小腹作疼，胎动不安，如有下坠之状，舌淡，脉弱。
http://www.zhongyoo.com/fangji/dgs_12474.html,当归散,组成当归、黄芩、芍药、川芎各一斤(各500克)，白术半斤(250克)。,用法为末，每次1.5克，每日2次口服。临床应用可改为汤剂，各药剂量按比例酌减，汤剂常用量，水煎服，每日2次。,养血安胎，清热调经。,妊娠血虚有热，症见胎动不安，难产或月经先期腹痛，或产后虚弱、恶露不行，舌红、脉滑小数。
http://www.zhongyoo.com/fangji/dbyj_6121.html,大补元煎,组成人参少则用一二钱多则用一二两(3～60克)，山药二钱(6克)，熟地黄少则用二三钱多则用一三两(6～90克)，杜仲二钱(6克)，当归二三钱(6～9克)，山茱萸一钱(3克)枸杞二三钱(6~9克)，炙甘草一二饯(3～6克)。,用法水煎服。,益气养血，肝肾双补。,气血两亏，精神委顿，腰酸耳鸣，汗出肢冷，心悸气短，脉微细。
http://www.zhongyoo.com/fangji/stw_12473.html,寿胎丸,组成菟丝子四两(120克)，桑寄生、续断、阿胶各二两(各60克)。,用法蜜丸，每次6克，每日2次口服。临床应用可改为汤剂，各药剂量按比例酌减至汤剂常用量，水煎服，每日2次。,固肾安胎。,孕妇胎元不固，症见胎动不安，腰酸腹坠，下血见红，或屡有滑胎，以及胎萎不长，胎音微弱，舌淡苔白，脉沉弱。
http://www.zhongyoo.com/fangji/tspsy_12472.html,泰山磐石饮,组成人参、黄芪、当归、续断、黄芩各一钱(3克)，白术二钱(6克)，川芎、白芍、熟地黄各八分(各2.4克)，砂仁、炙甘草各五分(1.5克)，糯米一撮。,用法水煎服，每剂煎3次，每曰3次，空腹口服。,补气健脾，养血安胎。,妇人气血两虚，胎元失养，症见胎动不安，或屡有流产，或面色淡白，倦怠无力，不思饮食，有坠胎先兆，舌质淡苔薄白，脉滑无力。
http://www.zhongyoo.com/fangji/wjw_12471.html,乌鸡丸,组成净乌鸡640克，地黄250克，当归144克，人参、鹿角胶、白芍、香附、山药、丹参各128克，鳖甲、天门冬、川芎、芡实各64克，桑螵蛸、煅牡蛎、鹿角霜各48克，黄芪、甘草各32克，银柴胡20克。,用法大蜜丸，每次1丸，每日2次，口服。,益气养血，调经止带。,妇女体虚，症见月经不调，经行腹痛，崩漏带下，腰腿酸痛，身体消瘦，舌淡苔薄，脉细弱。
http://www.zhongyoo.com/fangji/syw_12470.html,薯蓣丸,组成薯蓣三十分(30克)，当归、桂枝、神曲、干地黄、大豆黄卷各十分(各10克)，甘草二十八分(28克)，人参、阿胶各七分各7克)，川芎、白芍、白术、麦门冬、防风、杏仁各六分(各6克)，柴胡、桔梗、茯苓各五分(5克)，干姜三分(3克)，白蔹二分(2克)，大枣一百枚(100个)。,用法蜜丸，每次6～9克，每日1～2次口服。临床应用也可改为汤剂，水煎服，每日2次，各药剂量按汤剂常用量。,调理脾胃，益气和荣，祛风除邪。,虚劳不足、气血两虚、外兼风邪，症见头晕目眩，神疲乏力，心悸气短，身体瘦弱，不思饮食，健忘失眠，骨节酸痛，风气百疾，舌淡苔白，脉沉细。
http://www.zhongyoo.com/fangji/swysd_12469.html,首乌延寿丹,组成何首乌七十二两(2160克)、豨莶草十六两(480克)、菟丝子十六两(480克)、杜仲八两(240克)、牛膝八两(240克)、女贞子八两(240克)、霜桑叶八两(240克)、忍冬藤四两(120克)、生地黄四两(120克)、桑椹膏一斤(500克)、黑芝麻膏一斤(500克)、金樱子膏一斤(500克)、旱莲草膏一斤(500克)。,用法酌加炼熟白蜜，捣丸。每服10克，每日2次，温开水送服。,补益肝肾，滋养精血。,肝肾不足，头晕目花，耳鸣重听，四肢酸麻，腰膝无力，夜尿频数，须发早白等。
http://www.zhongyoo.com/fangji/syt_12468.html,圣愈汤,组成生地黄、熟地黄、川芎、人参各三分(各1克)，白芍、当归身、黄芪各五分(各1.5克)。,用法水煎服，现代用量应酌增。,益气，补血，摄血。,失血过多，气血两虚，面色无华，体倦神衰，夜寐不宁，舌质淡，脉细弱。
http://www.zhongyoo.com/fangji/dgbxt_12467.html,当归补血汤,组成黄芪一两(30克)、当归二钱(6克)。,用法上药研粗末，水煎服。现临床常用饮片作汤剂煎服。,补气生血。,劳倦内伤，元气虚弱，肌热面赤，烦偈欲饮，妇人经期、产后血虚发热、头痛，疮疡久溃不愈，脉洪大而虚、重按无力。
http://www.zhongyoo.com/fangji/gpt_1376.html,归脾汤,组成白术、当归、白茯苓、炒黄芪、龙眼肉、远志、炒酸枣仁各一钱(各3克)，木香五分(1.5克) ，炙甘草三分(1克)，人参一钱(3克)。,用法加生姜、大枣，水煎服。,益气补血，健脾养心。,
http://www.zhongyoo.com/fangji/rcyrt_12466.html,人参养荣汤,组成黄芪一两(30克)、当归一两(30克)、桂心一两(30克)、炙甘草一两(30克)、陈皮一两(30克)、白术一两(30克)、人参一两(30克)、白芍药三两(90克)、熟地黄三分(古制应为七钱半，约22克)、五味子三分(古制，应为七钱半约22克)、茯苓三分(10克)远志半两(15克)、生姜2片、大枣3枚。,用法水煎服。丸剂，每服9克，每日2～3次，温开水送服。,益气补血，养血安神。,脾肺气虚，营血不足，倦怠无力，食少气短，惊悸健忘，夜寐不安，咽干唇燥，毛发脱落，或疮疡溃后久不收敛，舌淡胖，脉虚弱。
http://www.zhongyoo.com/fangji/bzt_852.html,八珍汤,组成人参、白术、白茯苓、当归、川芎、白芍药、熟地黄、炙甘草，各一两(各30克)。,用法上㕮咀，每服三钱(9克)，水一盏半，加生姜五片，大枣一枚，煎至七分，去滓，不拘时候，通口服。 现代用法：或作汤剂，加生姜3片，大枣5枚，水煎服，用量根据病情酌定。,益气补血。,气血两虚证。面色苍白或萎黄，头晕目眩，心悸怔忡，四肢倦怠，气短懒言，饮食减少，舌淡苔薄白，脉细弱或虚大无力。
http://www.zhongyoo.com/fangji/sqdbt_12465.html,十全大补汤,组成当归(10克)、川芎(5克)、白芍(10克)、熟地黄(10克)、人参(10克)、白术(10克)、茯苓(10克)、炙甘草(5克)、黄芪(10克)、肉桂(3克)。,用法水煎服。原方各等分，现一般改用饮片，酌定剂量，水煎服。丸剂，每服6~9克，每日2～3次；膏剂，每服15克，每日2次。,温补气血。,气血不足，虚劳咳喘，面色苍白，脚膝无力，遗精，崩漏，经候不调，疮疡不收，舌淡，脉细弱。
http://www.zhongyoo.com/fangji/swt_12464.html,四物汤,组成当归、川芎、白芍、熟地黄。,用法上药各等分，研粗末。每服9克，水煎服。现临床常用饮片作汤剂煎服，各药用量按常规剂量酌定。,补血调血，调经化瘀。,营血虚滞，惊惕头晕，目眩耳鸣，面色萎黄，唇爪无华，月水不调，脐腹疼痛，舌质淡，脉弦细或细涩。
http://www.zhongyoo.com/fangji/hry_12463.html,何人饮,组成何首乌三钱至一两(9～30克)、当归二三钱(6～9克)、人参三五钱至一两(9～30克)、陈皮二三钱(6～9克) 、煨姜三片。,用法水煎，疟疾发作前2～3小时服。,补肺肾，益肾精。,肺虚劳热，咳逆，老人精血亏损，便秘，产后发热，舌质淡，脉细弱。
http://www.zhongyoo.com/fangji/bzt_12462.html,保真汤,组成当归、生地黄、白术、黄芪、人参各三钱(9克)，赤茯苓、陈皮、赤芍药、甘草、白茯苓、厚朴各一钱五分(4.5克)，天门冬、麦门冬、白芍药、知母、黄柏、五味子、柴胡、地骨皮、熟地黄各钱(3克)。,用法加生姜三片、大枣五枚，水煎服。,益气健脾化湿，滋阴养血清热。,肺脾不足，精神困倦，食纳减少，脘腹胀闷，肌肤不充，身热虚烦，自汗盗汗；肾阴亏虚，骨蒸潮热，耳鸣耳聋，睡眠欠安，记忆力减退，口干咽痛，五心烦热；气阴两伤，气短乏力，干咳少痰，痰中带血，月经量多，崩漏不止，遗精早泄，小便涩赤，低热绵绵，脉象虚细带数。
http://www.zhongyoo.com/fangji/sct_12461.html,三才汤,组成人参三钱(9克)、天门冬二钱(6克)、干地黄五钱(15克)。,用法水五杯，浓煎两杯，分两次温服。,补气养阴生津。,主治暑邪久热，元气阴液两伤，寝卧不安，不思饮食，神识不清，舌淡红嫩少苔，脉虚细。
