链接,名字,组成,用法,功效,主治
http://www.zhongyoo.com/fangji/tgw_12870.html,通关丸,组成黄柏一两(30克)、知母一两(30克)、肉桂半钱(1.5克)。,用法上药共研细末，水或炼蜜泛为丸。每服6克，每日2次，开水送服。,清热化气，通利小便。,主治湿热蕴结膀胱，癃闭不通，小腹胀满，或尿道涩痛，舌红，脉细涩。
http://www.zhongyoo.com/fangji/wps_12869.html,五皮散,组成生姜皮、桑白皮、陈橘皮、大腹皮、茯苓皮。,用法上药等分，共研粗末，每用9克，水煎，不拘时温服。亦可改用饮片水煎服，各药用量按常规剂量酌定。,利水消肿，行气健脾。,主治皮水，一身悉肿，肢体沉重，胸腹胀满，上气喘促，小便不利，苔白腻，脉沉缓。
http://www.zhongyoo.com/fangji/dsflt_12868.html,导水茯苓汤,组成赤茯苓三两(90克)、麦门冬三两(90克)、泽泻三两(90克)、白术三两(90克)、桑白皮一两(30克)、大腹皮七钱五分(20克)、紫苏一两(30克)、槟榔一两(30克)、陈皮七钱五分(20克)、木瓜一两(30克)、木香七钱五分(20克)、砂仁七钱五分(20克),用法上药研粗末。每用15克，加灯心25根，水煎服。也可用饮片作煎剂，各药用量据常规剂量酌减。,健脾渗湿，利水消肿。,主治水肿，喘满倚息，不能平卧，饮食不下，小便涩痛，舌淡苔白，脉濡细。
http://www.zhongyoo.com/fangji/gcgjflbst_12867.html,甘草干姜茯苓白术汤,组成甘草二钱(6克)、白术二钱(6克)、干姜四钱(12克)、茯苓四钱(12克)。,用法水煎服。,温脾渗湿。,主治肾着病，腰及腰以下重坠冷痛，口不渴，小便自利，苔白，脉沉细。
http://www.zhongyoo.com/fangji/qsbss_12865.html,钱氏白术散,组成人参二钱五分(7.5克)、白术五钱(15克)、藿香叶五钱(15克)、茯苓五钱(15克)、木香二钱(6克)、甘草一钱(3克)、葛根五钱(15克)。,用法上药均研粗末。每次9克，水煎服。亦可用饮片水煎服。,健脾益气，和胃生津。,主治脾胃久虚，津液内耗，呕吐泄泻频作，烦渴多饮，舌淡苔白，脉沉迟。
http://www.zhongyoo.com/fangji/sps_12864.html,实脾散,组成炮附子二钱(6克)、白术二钱(6克)、白茯苓二钱(6克)、干姜二钱(6克)、厚朴二钱(6克)、木瓜二钱(6克)、木香二钱(6克)、草果仁二钱(6克)、大腹子二钱(6克)、甘草一钱(3克)、生姜三片、大枣三枚。,用法上药为粗末，每用12克，水煎服。亦可改用饮片水煎服。,温阳健脾，行气利水。,主治阳虚水肿，身半以下肿甚，胸腹胀满，或腹大身重，体倦食少，手足不温，口中不渴，大便溏薄，小便短少，苔腻，脉沉迟或沉细。
http://www.zhongyoo.com/fangji/fjflt_12863.html,防己茯苓汤,组成防己三钱(9克)、黄芪三钱(9克)、桂枝三钱(9克)、茯苓六钱(18克)、甘草二钱(6克)。,用法水煎服。,益气通阳，利水消肿。,主治皮水，周身浮肿，四肢肿胀，四肢聂动者，舌苔白，脉浮。
http://www.zhongyoo.com/fangji/wlt_12862.html,胃苓汤,组成苍术、陈皮、厚朴、茯苓、猪苓、泽泻、官桂、白术、甘草。,用法上药等分共研粗末，每用15克，加生姜5片、大枣2枚，水煎服。也可改用饮片水煎服，各药用量按常规剂量酌定。,健脾和中，利水化湿。,主治寒湿内阻，腹痛泄泻，小便不利，舌苔白，脉濡。
http://www.zhongyoo.com/fangji/zlt_12861.html,猪苓汤,组成猪苓三钱(9克)、茯苓三钱(9克)、泽泻三钱(9克)、滑石三钱(9克)、阿胶三钱(9克)。,用法水煎服。,利水清热养阴。,主治水热互结，邪热伤阴，小便不利，发热，口渴欲饮，或见心烦不寐，或兼有咳嗽、呕恶、下利，舌苔白，脉濡。
http://www.zhongyoo.com/fangji/sls_12860.html,四苓散,组成茯苓、猪苓、泽泻、白术。,用法上药等分，共为细末。每服6克，空腹调服。如用饮片作汤剂，各药用量按常规剂量酌定。,健脾除湿。,主治脾虚湿阻，小便短少，大便溏泄，舌苔白，脉浮。
http://www.zhongyoo.com/fangji/hszzw_12859.html,回生再造丸,组成水安息(120克)、人参(60克)、蕲蛇(120克)、当归(60克)、川芎(60克)、川连(60克)、羌活(60克)、防风(60克)、玄参(60克)、乳香(60克)、白芷(60克)、茯苓(60克)、麻黄(60克)、天麻(60克)、川萆薢(60克)、姜黄(6D克)、甘草(60克)、肉桂(60克)、白蓬仁(60克)、何首乌(60克)、琥珀(60克)、黄氏(60克)、大黄(60克)、草豆蔻(60克)、雄鼠粪(60克)、熟地黄(60克)、芽山甲(60克)、全蝎(75克)、威灵仙(75克)、葛根(75克)、桑寄生(75克)、细辛(30克)、赤芍(30克)、乌药(30克)、青皮(30克)、於术(30克)、僵蚕(30克)、乳香(30克)、没药(30克)、辰砂(30克)、骨碎补(30克、)香附(30克)、天竺黄(30克)、附子(30克)、龟板(30克)、沉香( 30克)、丁香(30克)、胆星(30克)、红花(24克)、犀角(24克)、厚朴(15克)、地龙(15克)、松香(15克)、木香(12克)、冰片(7.5克)、牛黄(7.5克)、血竭(2.4克)、虎胫骨(1对)。,用法上药共研细末，炼蜜和匀为丸，每丸重3克，金铂为衣。每服1丸，生姜汤送服。,祛风除痰，话血祛瘀，通利经络。,主治中风，半身不遂，口眼歪斜，手足拘挛，筋骨疼痛，步履艰难等，舌淡苔白，脉弦细或细弱。
http://www.zhongyoo.com/fangji/xhld_12858.html,小活络丹,组成制川乌、制草乌、制南星、地龙各六两(各180克)，乳香、没药各二两二钱(各66克)。,用法上药研为细末，酒糊为丸。每服1丸(约3克)；片剂，每服3～5片，每日2次，温开水送服。亦可用饮片做汤剂水煎服，各药用量按常规加量酌减。,祛风除湿，化痰通络，活血止痛。,主治风湿痰瘀，痹阻经络，筋骨疼痛， 肢体麻木，关节屈伸不利，舌淡苔白，脉弦细。
http://www.zhongyoo.com/fangji/dhld_6123.html,大活络丹,组成白花蛇(60克)、乌梢蛇(15克)、麻黄(60克)、细辛(30克)、全蝎(45克)、两头尖(60克)、赤芍(30克)、贯众(60克)、防风(75克)、葛根(15克)、没药(30克)、血竭(23克)、朱砂(30克)、乌犀屑(15克)、地龙(15克)、炙甘草(60克)、丁香(30克)、白僵蚕(30克)、乳香(30克)、麝香(15克)、片脑(4.5克)、官桂(60克)、草豆蔻(60克)、川羌活(60克)、虎胫骨(30克)、玄参(30克)、牛黄(7.5克)、威灵山(4.5克)、天麻(60克)、藿香(60克)、天竺黄(30克)、败龟板(30克)、人参(30克)、何首乌(60克)、白芷(60克)、乌药(30克)、安息香(30克)、青皮(30克)、黑附子(30克)、香附(30克)、白豆蔻(30克)、骨碎补(30克)、黄连(60克)、茯苓(30克)、黄芩(60克)、白术(30克)、熟地黄(60克)、松香脂(15克)、大黄(60克)、当归(45克)、木香(60克)、沉香(30克)。,用法上药共为细末，炼蜜为丸，金箔为衣，如弹子大，重4.5～6克。每服1丸，黄酒化服，或温开水送服，每日1～2次。,祛风化湿，舒筋活络。,主治风湿痹痛，跌仆伤痛，中风后四肢痿痹，步履困难，舌淡苔白，脉弦细。
http://www.zhongyoo.com/fangji/dqqt_12857.html,大秦艽汤,组成秦艽三两(90克)，川芎、独活、当归、白芍、石膏、甘草各二两(各60克)，羌活、防风、白芷、黄芩、白术、茯苓、生地黄、熟地黄各一两(各30克)，细辛半两(15克)。,用法上药研为粗末，每服30克，水煎服。现多用饮片水煎服，各药用量按常规剂量酌减。,祛风养血，清热通络。,风邪初中经络，口眼喁斜，舌强不能语言，手足不能活动，烦热，口苦、苔黄者。
http://www.zhongyoo.com/fangji/xbt_12856.html,宣痹汤,组成防己五钱(15克)、杏仁五钱(15克)、滑石五钱(15克)、连翘三钱(9克)、栀子三钱(9克)、薏苡仁五钱(15克)、半夏醋炒三钱(9克)、晚蚕沙三钱(9克)、赤小豆皮三钱(9克)。,用法水煎服。,清热祛湿，宣通经络。,主治湿热痹证，骨节疼痛，局部灼热红肿，或兼有发热恶寒，小便短赤，舌苔黄腻。
http://www.zhongyoo.com/fangji/szhzt_12855.html,桑枝虎杖汤,组成桑枝30克、虎杖根15克、金雀根30克、臭梧桐30克、红枣10枚。,用法水煎服。,祛风湿，通经络，止疼痛。,主治风湿或劳损，关节肌肉痹痛，手脚麻木，动作不利，舌淡苔白，脉弦细。
http://www.zhongyoo.com/fangji/_tw_12852.html,豨桐丸,组成豨莶草、臭梧桐叶。,用法上药各等分，共研细末，制为丸剂。每服6～9克，每日3次。片剂，每片约含生药1.25克，每服4片，每日2次。,祛风湿，利筋骨。,主治风湿痹痛，腰膝酸软软，步履不健，舌淡苔白，脉弦细。
http://www.zhongyoo.com/fangji/stzyt_12851.html,身痛逐瘀汤,组成秦艽(3克)、川芎(6克)、桃仁(9克)、红花(9克)、甘草(6克)、羌活(3克)、没药(6克)、当归(9克)、五灵脂(6克)、香附(3克)、牛膝(9克)、地龙(6克)。,用法水煎服。,活血祛瘀，通络止痛。,主治气血痹阻肩痛，臂痛，腰痛，或周身疼痛，日久不愈，舌紫暗，或有瘀斑，脉涩弦。
http://www.zhongyoo.com/fangji/csjbt_12850.html,除湿蠲痹汤,组成苍术(6克)、白术(3克)、茯苓(3克)、羌活(3克)、泽泻(3克)、陈皮(3克)、甘草(1.5克)、姜汁3匙(冲)、竹沥3匙(冲)。,用法水煎服，每日2次。亦可加热熏蒸用。,健脾利湿，通痹止痛。,主治着痹身重疼痛，痛有定处，舌淡苔白，脉弦细。
http://www.zhongyoo.com/fangji/yyrt_12849.html,薏苡仁汤,组成薏苡仁(15克)，当归、川芎、生姜、桂枝、羌活、独活、防风、白术、草乌、川乌(各9克)，麻黄(4.5克)。,用法水煎服。原书未著用量，可根据常规剂量应用。,祛风除湿，散寒通络。,主治湿痹，关节疼痛重着，痛有定处，手足沉重，或有麻木不仁，舌苔白腻，脉象濡缓等。
http://www.zhongyoo.com/fangji/fft_12848.html,防风汤,组成防风(30克)、甘草(30克)、当归(30克)、赤茯苓(30克)、杏仁(30克)、桂枝(30克)、黄芩(9克)、秦艽(9克)、葛根(9克)、麻黄(15克)。,用法上药研末。每用15克，加大枣3枚、生姜5片，水煎服。,祛风通络，散寒除湿。,主治行痹，肢体关节疼痛，游走不定，关节伸屈不利，或见恶寒发热，苔薄白或腻，脉浮。
http://www.zhongyoo.com/fangji/gzsyzmt_12847.html,桂枝芍药知母汤,组成桂枝四两(12克)、芍药三两(9克)、甘草二两(6克)、麻黄二两(6克)、知母三两(9克)、生姜五两(9克)、白术五两(9克)、防风四两(9克)、附子两枚(6克)。,用法水煎服，每日1剂。,通阳行痹，祛风逐湿。,主治肢节疼痛，身体赢弱，脚肿如脱，头眩短气，温温欲吐，舌偏红苔白，脉濡数。
http://www.zhongyoo.com/fangji/gzfzt_12846.html,桂枝附子汤,组成桂枝四两(9克)、附子三枚(9克)、炙甘草二两(6克)、生姜三两(9克)、大枣十二枚(9克)。,用法水煎服。目前临床各药用量均按常规剂量酌减。,祛风除湿，温经散寒。,主治风寒湿外袭肌表，身体疼烦，不能转侧，以及阳虚内寒的胸腹疼痛，喘咳泄泻，舌苔薄白，脉浮虚而涩。
http://www.zhongyoo.com/fangji/bsfzt_12845.html,白术附子汤,组成附子(9克)、白术(12克)、生姜(9克)、炙甘草(6克)、大枣(12枚)。,用法水煎服。,散寒化湿，祛风通络。,风湿相搏，身体疼烦，不能自转侧，不呕不渴，大便硬，小便自利，舌质淡，苔白，脉弦细或细涩。
http://www.zhongyoo.com/fangji/hcgzwwt_12844.html,黄芪桂枝五物汤,组成黄芪(9克)、桂枝(9克)、芍药(9克)、生姜(18克)、大枣(10枚)。,用法水煎服。,温阳行痹。,主治血痹，肌肤麻木不仁，脉微而涩紧。
http://www.zhongyoo.com/fangji/wbt_12843.html,五痹汤,组成片姜黄(30克)、炙甘草(15克)、羌活(30克)、白术(30克)、防己(30克)。,用法上药共为粗末。每次用12克，加生姜10片，水煎服。,功效】祛风除湿，通络止痛。,主治风寒湿痹，经络不利，肢节疼痛，麻痹不仁。
http://www.zhongyoo.com/fangji/jbt_12842.html,蠲痹汤,组成当归、羌活、姜黄、黄芪、白芍、防风各一两(各9克)，甘草半两(3克)。,用法水煎服。,祛风除湿，散寒通络。,主治风寒湿邪所致的痹证，肢体重着，关节酸痛，活动不利，得热则减，遇阴雨寒冷则加剧，舌苔白腻，脉弦紧等。
http://www.zhongyoo.com/fangji/wtt_12841.html,乌头汤,组成麻黄、黄芪、芍药、炙甘草各三两(各9克)、川乌五枚(9克)。,用法水煎服。,温经散寒，舒筋止痛。,主治寒涩痹痛，痛有定处，遇寒则甚，肢节挛缩，不可屈伸，舌苔薄白，脉弦紧等。
http://www.zhongyoo.com/fangji/fzt_12840.html,附子汤,组成附子两枚(9克)、茯苓三两(9克)、人参二两(6克)、白术四两(12克)、芍药三两(9克)。,用法水煎服。,温阳散寒，化湿利痹。,主治寒湿内侵，身体骨节疼痛，恶寒肢冷，苔白滑，脉沉细无力。
http://www.zhongyoo.com/fangji/act_12839.html,安冲汤,组成炒白术(18克)、生黄芪(18克)、生龙骨捣细(18克)、生牡蛎捣细(18克)、大生地(18克)、生杭芍(9克)、海螵蛸捣细(12克)、茜草(9克)、川续断(12克)。,用法水煎服。,益气健脾，安冲摄血。,主治脾虚气弱、冲脉不固所致妇女月经过多，经行时久，过期不止或不时漏下等，舌质淡，苔白，脉虚软无力或细弱。
http://www.zhongyoo.com/fangji/zgt_12838.html,苎根汤,组成苎麻根(15克)、干地黄(15克)、当归(9克)、芍药(9克)、阿胶(9克)(另烊化分2次冲)、炙甘草(9克)。,用法水煎服。,养血安胎，止漏。,主治劳损胎动下坠，小腹痛，阴道出血，腹痛腰酸等，舌质淡，苔白，脉弦细或细滑。
http://www.zhongyoo.com/fangji/gqy_12837.html,过期饮,组成当归(6克)、白芍(6克)、熟地黄(6克)、香附(6克)、川芎(3克)、红花(2克)、桃仁(2克)、莪术(1.5克)、木通(1.5克)、炙甘草(1克)、肉桂(1克)。,用法水煎服。,补血化瘀，理气调经。,主治血虚气滞，月经过期不行等，舌质淡，苔白，脉弦细或细弱。
http://www.zhongyoo.com/fangji/sw_gylrw_12834.html,四乌鲗骨一芦茹丸,组成乌贼骨四份，茜草一份。,用法上研末，以雀卵为丸。每服3～6克，每日2～3次。,益精补血，止血化瘀。,主治妇女血枯病，唾血，二便出血，胸胁胀满，不思饮食，四肢清冷，头晕目眩，发病可闻及腥臊气味，鼻流清涕，月事渐少以至闭经，舌质淡，苔白，脉弦细或细弱。
http://www.zhongyoo.com/fangji/jat_12833.html,胶艾汤,组成川芎、烊化阿胶(分2次冲),用法水煎服。,补血止血，调经安胎。,主治妇女冲任虚损，崩中漏下，月经过多，淋漓不止，或妊娠下血，胎动不安，或产后下血不绝，舌质淡，苔白，脉沉细或细弱。
http://www.zhongyoo.com/fangji/byt_12832.html,柏叶汤,组成侧柏叶(15克)、干姜(6克)、艾叶(6克)。,用法水煎服。原书尚有马通汁，现已不用。,温经止血。,主治吐血不止，面色萎黄，舌淡，脉虚无力者。
http://www.zhongyoo.com/fangji/bzjyf_12831.html,崩证极验方,组成生地黄(15克)、白芍(9克)、黄芩(9克)、黄连(6克)、牡丹皮(9克)、焦山栀(9克)、莲须(9克)、地榆(12克)、牡蛎(30克)、甘草(9克)。,用法水煎服。,清热止血。,主治妇女血崩、景多色红，口燥唇焦等，舌红，苔黄，脉弦细数。
http://www.zhongyoo.com/fangji/qjs_12830.html,清经散,组成牡丹皮(9克)、地骨皮(15克)、白芍(9克)、熟地黄(6克)、青蒿(6克)、茯苓(3克)、盐水炒黄柏(1.5克)。,用法水煎服。,清热凉血。,主治月经先期，肾中水火两旺者，伴见舌红，苔黄，脉弦细数。
http://www.zhongyoo.com/fangji/dys_12829.html,地榆散,组成地榆(30克)、黄芪(30克)、枳壳(30克)、槟榔(30)、黄芩(30克)、赤芍(30克)、当归(30克)。,用法上药共研为散，每用12克，水煎服。也可用饮片作汤剂，各药用量按常规剂量。,清热理气，行瘀止血。,主治痔疮肿痛，下血不止等。
http://www.zhongyoo.com/fangji/jqswt_12828.html,荆芩四物汤,组成生地黄(15克)、当归(9克)、川芎(6克)、白芍(9克)、荆芥(9克)、黄芩(9克)。,用法水煎服。,清热止血。,主治月经先期、色鲜红、量多，舌红，苔黄，脉弦细数。
http://www.zhongyoo.com/fangji/zbswt_12827.html,知柏四物汤,组成生地黄(15克)、当归(9克)、川芎(6克)、白芍(9克)、知母(9克)、黄柏(9克)。,用法水煎服。,滋阴降火，调经和血。,主治阴虚火旺，腹痛，脉细数，月经量多，色鲜，妊娠胎动，脉洪虚数等。
http://www.zhongyoo.com/fangji/swjhqhlt_12826.html,四物加黄芩黄连汤,组成生地黄(15克)、当归(9克)、白芍(9克)、川芎(8克)、黄芩(9克)、黄连(6克)。,用法水煎服。每日1剂，每日2次。,凉血清热。,主治月经先期量多，或色黑如黑豆汁者，舌红，苔黄，脉弦细数。
http://www.zhongyoo.com/fangji/sxy_12825.html,三鲜饮,组成鲜茅根四两(120克)、鲜藕节四两(120克)、鲜小蓟根二两(60克)。,用法水煎服。煮汁，常常饮之。,凉血止血。,主治虚劳，痰中带血，兼有虚热等症。
http://www.zhongyoo.com/fangji/kxf_12824.html,咳血方,组成水飞青黛、诃子(各6克)，去油瓜蒌仁、海浮石、炒黑栀子(各9克)。,用法上药共为细末，以蜜同姜汁为丸，每用1丸(5克)，含口中噙化。也可改用饮片作汤剂水煎服，各药用量按常规剂量酌定。(原方书为海粉，清·汪昂将其改为海浮石),清火化痰，止咳止血。,主治肝火灼肺，咳痰带血，痰稠不爽，心烦口渴，颧红便秘，舌苔黄，脉弦数等。
http://www.zhongyoo.com/fangji/ssw_12823.html,四生丸,组成生荷叶、生艾叶、生柏叶、生地黄。,用法将上述4药各等分捣烂为丸。每服1丸(约30克)，水煎服；现多用鲜药捣汁凉服或炖温服。也可用饮片作汤剂水煎服，各药用量按常规剂量酌定。,凉血止血。,主治血热妄行，咯血，吐血，衄血，出血鲜红、口干咽燥等症，伴见舌红或绛，苔黄，脉弦细数。
http://www.zhongyoo.com/fangji/cfyst_12822.html,除风益损汤,组成熟地黄、当归、白芍、川芎(各6克)，藁本、前胡、防风(各4.5克)。,用法每日2次，水煎服。,养血祛风，活血通络。,主治目为物伤，血虚头痛。
http://www.zhongyoo.com/fangji/ddw_8325.html,跌打丸,组成没药、乳香、麻黄、自然铜各60克，当归、川芎、土鳖虫、血竭各30克，马钱子、麝香各12克。,用法上药共研细末，炼蜜为丸，丸重4.5克。每服1丸，每日2次，黄酒或温开水送下。,散瘀消肿止痛。,主治跌打损伤，伤纯青紫红肿，疼痛不止，以及闪腰挫气疼痛等。
http://www.zhongyoo.com/fangji/lct_12821.html,理冲汤,组成生山药(15克)，天花粉、知母(各12克)，黄芪、三棱、莪术、鸡内金(各9克)，党参、白术(各6克)。,用法水煎服，每日2次。,健脾益气祛瘀，调经散结。,主治妇女经闭不行或产后恶露不尽，结为癥瘕，并治男子劳瘵，气郁满闷，痞胀，不能饮食等。
http://www.zhongyoo.com/fangji/tyj_12820.html,通瘀煎,组成当归尾三五饯(9～15克)，山楂、香附、红花各二钱(各6克)，乌药一二钱(3～6克)，青皮一钱半(4.5克)，木香7分(2克)，泽泻一钱半(4.5克)。,用法水煎服，每日2次。,活血祛瘀，行气止痛。,主治妇人气滞血积，经脉不利，痛极拒按，舌淡，苔白，脉弦细。
http://www.zhongyoo.com/fangji/wjt_12817.html,温经汤,组成吴茱萸、麦门冬各三两(各9克)，当归、芍药、川芎、人参、桂枝、阿胶、去心牡丹皮、生姜、甘草、半夏各二两(各6克)。,用法上十二味，以水一斗，煮取三升，分温三服。现代用法：水煎服，阿胶烊冲。,温经散寒，养血祛瘀。,主治冲任虚寒，瘀血阻滞，症见漏下不止，血色暗而有块，淋漓不畅，或月经超前或延后，或逾期不止，或一月再行，或经停不至，而见少腹里急，腹满，傍晚发热，手心烦热，唇口干燥，舌质暗红，脉细而涩。亦治妇人宫冷，久不受孕。
http://www.zhongyoo.com/fangji/gwyf_12816.html,宫外孕方,组成1号方：丹参、赤芍各五钱(各15克)，桃仁三钱(9克)。,用法水煎服。,活血祛瘀，消癥止痛。,主治宫外孕、子宫周围炎、附件炎、盆腔炎、痛经、不孕症等。
http://www.zhongyoo.com/fangji/gzflw_12815.html,桂枝茯苓丸,组成桂枝、茯苓、牡丹皮、桃仁、芍药。,用法上药各等分，共研细末，炼蜜为丸。每服6～9克，每日1～3次，食前服。,活血，化瘀，消癥。,主治妇人宿有癥块，或血瘀经闭，行经腹痛，产后恶露不尽，舌淡紫，苔白，脉弦细涩。
http://www.zhongyoo.com/fangji/bjjw_12814.html,鳖甲煎丸,组成炙鳖甲、赤硝各十二分(各90克)，蜣螂六分(45克)，芍药、牡丹、土蟞虫各五分(各37克)，蜂巢四分(30克)，炒乌扇、柴胡、黄芩、鼠妇、干姜、大黄、桂枝、厚朴、石韦、紫葳、炙阿胶各三分(各22.5克)，瞿麦、桃仁各二分(各15克)，葶苈、半夏人参各一分(各7.5克)。,用法上为末，炼蜜为丸，每丸3克，每日3次。,活血化瘀，软坚散结。,主治胁下癥块，伴见舌淡紫，苔白，脉弦细涩。
http://www.zhongyoo.com/fangji/dhzcw_12813.html,大黄蛰虫丸,组成大黄十分(75克)，黄芩二两(60克)，甘草三两(90克)，桃仁、杏仁各一升(各60克)，芍药四两(120克)，干地黄十两(300克)，干漆一两(30克)， 虻虫一升(60克)，水蛭百枚(60克)，蛴螬一升(60克)，蛰虫(土蟞虫)半升(30克)。,用法上十二味，末之，炼蜜和丸小豆大，酒饮服3克，日三服。现代用法：将蛴螬另串；桃仁、杏仁另研成泥。其余9味共研为细粉，过罗，与桃仁等混合均匀，共为细粉。炼蜜为丸，每粒3克，蜡皮封固。每服1丸，温开水或酒送服。,破血消癥，祛瘀通经。,主治干血内结，五劳虚极，瘀结成块，妇女经闭，肌肤甲错，两目黯黑，潮热消瘦等。
http://www.zhongyoo.com/fangji/dgsys_12812.html,当归芍药散,组成当归三两(9克)，芍药一斤(30克)，泽泻、川芎半斤(15克)，茯苓、白术四两(12克)。,用法上为散。每服方寸匕，酒和服，一日三次。现代临床应用多改散为汤剂，水煎服，每日2次。,调血养肝，健脾利湿。,主治妇人妊娠或经期，肝脾两虚，腹中拘急，绵绵作痛，头晕心悸，或下肢浮肿，小便不利，舌质淡，苔白腻者。后又用于纠正胎位。
http://www.zhongyoo.com/fangji/ffdgzsy_7615.html,复方当归注射液,组成当归、川芎、红花。,用法上药各等分，制成注射剂。穴位或肌内注射，每次2～4毫升，每日或隔日1次。,活血止痛。,主治各种急、慢性肌肉劳损，关节疼痛，外伤截瘫等，伴见舌淡，苔白，脉弦细。
http://www.zhongyoo.com/fangji/ffdczsy_12811.html,复方丹参注射液,组成丹参、降香。,用法上药制成注射剂，每支2毫升，每1毫升相当于丹参、降香各1克。肌内注射，每次1支，每日1～2次；静脉注射，可加入低分子右旋糖酐或葡萄糖内滴注，剂量根据病情需要酌定。,活血化瘀，理气宽胸。,主治胸痹，心痛等病症。
http://www.zhongyoo.com/fangji/dcy_12810.html,丹参饮,组成丹参一两(30克)，檀香、砂仁各一钱半(各4.5克)。,用法水煎服，每日2次。,活血祛瘀，行气止痛。,主治血瘀气滞，心胃诸痛，舌淡，苔白，脉弦细。
http://www.zhongyoo.com/fangji/chxxt_12809.html,柴胡细辛汤,组成柴胡(6克)、土鳖虫(9克)、丹参(9克)、制半夏(6克)、泽兰(9克)、当归(9克)、川芎(6克)、细辛(6克)、薄荷(6克)、黄连(3克)。,用法水煎服，每日2次。,祛瘀生新，调和升降。,主治头部内伤(脑震荡)昏迷苏醒后或无明显昏迷，所致的头晕、头痛、嗜卧、泛泛欲恶等，舌淡，苔白，脉弦细。
http://www.zhongyoo.com/fangji/hlxld_12808.html,活络效灵丹,组成当归、丹参、乳香、没药各三钱(各15克)。,用法水煎服，每日2次。也可共研细末为散剂，1剂分作4次服，每日2次，用温酒送下。,活血祛瘀，通络止痛。,主治气血瘀滞，心腹疼痛，腿臂疼痛，跌打瘀肿，内外疮疡，以及癥瘕积聚等。
http://www.zhongyoo.com/fangji/dgntt_12807.html,当归拈痛汤,组成羌活、甘草、茵陈各半两(各15克)，防风、苍术、当归身、知母、猪苓、泽泻各三钱(各9克)，升麻、白术、黄芩各一钱(各3克)，葛根、人参、苦参各二钱(各6克),用法水煎服，每日2次。,利湿清热，疏风止痛。,主治湿热相搏，外受风邪，症见遍身肢节烦痛，或肩背沉重，或脚气肿痛，脚膝生疮，舌苔白腻微黄，脉弦数。
http://www.zhongyoo.com/fangji/sxs_12806.html,失笑散,组成五灵脂、蒲黄各等分。,用法研为末，每服6克，每日1～2次。亦可用布袋包，入汤煎，或改用饮片水煎服，每日2次。,活血祛瘀，散结止痛。,主治瘀血停滞，症见心腹刺痛，或产后恶露不行，或月经不调，少腹急痛，舌淡，苔白，脉弦细。
